,nct_id,id.x,name,downcase_name,id.y,sampling_method,gender,minimum_age,maximum_age,healthy_volunteers,population,criteria,gender_description,gender_based,adult,child,older_adult,inclusion_criteria,exclusion_criteria
343,NCT01832051,92548243,Metastatic Breast Cancer,metastatic breast cancer,53970405,NA,Female,18 Years,N/A,No,NA,"Inclusion Criteria:

Patients with a history of histological and/or cytological proven HER2-positive primary breast cancer. In the Netherlands HER2-positivity is defined as:

HER2 immunohistochemical score of 3+, or
HER2 immunohistochemical score of 2+ and positive FISH for HER2/c-erbB2 amplification.

In Belgium HER2-positivity is defined as positive FISH for HER2/c-erbB2 amplification.

Patients with suspected metastatic disease or local recurrence of HER2-positive breast cancer and a clinical dilemma:

in whom standard work up with imaging has failed to solve the clinical dilemma (diagnostic/therapeutic), leaving issues with regard to HER2 status of lesions and
in whom a biopsy is desirable but cannot (easily) be performed due to technical or patient factors or otherwise.
Standard work-up with imaging is defined as CT chest and abdomen, bone scintigraphy, as well as FDG-PET.
Age >18 years of age.
WHO performance status 0-2.
Signed written informed consent.
Able to comply with the protocol.

Exclusion Criteria:

Pregnant or lactating women.
Prior allergic reaction to immunoglobulins or immunoglobulin allergy.
Inability to comply with study procedures",NA,NA,TRUE,FALSE,TRUE,"patients with a history of histological and/or cytological proven her2-positive primary breast cancer. in the netherlands her2-positivity is defined as:

her2 immunohistochemical score of 3+, or
her2 immunohistochemical score of 2+ and positive fish for her2/c-erbb2 amplification.

in belgium her2-positivity is defined as positive fish for her2/c-erbb2 amplification.

patients with suspected metastatic disease or local recurrence of her2-positive breast cancer and a clinical dilemma:

in whom standard work up with imaging has failed to solve the clinical dilemma (diagnostic/therapeutic), leaving issues with regard to her2 status of lesions and
in whom a biopsy is desirable but cannot (easily) be performed due to technical or patient factors or otherwise.
standard work-up with imaging is defined as ct chest and abdomen, bone scintigraphy, as well as fdg-pet.
age >18 years of age.
who performance status 0-2.
signed written informed consent.
able to comply with the protocol.","

pregnant or lactating women.
prior allergic reaction to immunoglobulins or immunoglobulin allergy.
inability to comply with study procedures"
344,NCT01835236,92475864,Metastatic Breast Cancer,metastatic breast cancer,53929711,NA,Female,18 Years,N/A,No,NA,"SELECTION OF PATIENTS (MOST IMPORTANT CRITERIA)

Inclusion criteria for first-line therapy

• Histologically confirmed breast cancer with distant metastases

Note:

A biopsy from the primary tumor or a metastasis can be used for diagnosis.
Patients with non-measurable lesions are eligible.
Patients with inoperable, locally advanced breast cancer with lymph node metastases other than ipsilateral locoregional (axillary, infraclavicular, parasternal) or other distant metastases are eligible.
Patients with bone metastases with or without bone targeted therapy (bisphosphonates, denosumab) are eligible.

Patients with de-novo Stage IV disease are eligible.

HER2-positive tumor according to central pathology testing for HER2

Note:

A formalin-fixed paraffin-embedded (FFPE) biopsy from the primary tumor or a metastasis has to be used for HER2 status determination. If a biopsy is available from a metastasis, the HER2 testing should be performed using the metastasis.

Fine needle aspiration is not acceptable for HER 2 testing. • Women aged ≥18 years

• WHO performance status 0 to 2

Left Ventricular Ejection Fraction (LVEF) ≥50% as determined by either ECHO or MUGA
Adequate organ function, evidenced by the following laboratory results:

Neutrophils >1.5x109/L, platelets >100x109/L, hemoglobin ≥90g/L, total bilirubin ≤1.5xULN (unless the patients has documented Gilbert's disease), AST ≤3xULN, ALT ≤3xULN, AP ≤2.5xULN (except in patients with bone metastases: AP ≤5xULN), creatinine ≤1.5xULN

Exclusion criteria for first-line therapy

• Prior chemotherapy for inoperable locally advanced or metastatic breast cancer

Note:

Prior neoadjuvant/adjuvant chemotherapy is allowed if doses for anthracyclines have not exceeded 720mg/m2 and 240mg/m2 for epirubicin and doxorubicin, respectively.

- Re-exposure to paclitaxel is permitted, if the last dose of taxane was given at least 1 year before randomization.

- Re-exposure to vinorelbine is permitted, if the last dose of vinorelbine was given at least 1 year before randomization.

Prior anti-HER2 treatment for metastatic or inoperable breast cancer

Note:

Prior neoadjuvant/adjuvant anti-HER2 treatment with trastuzumab and/or lapatinib is allowed.

• More than one endocrine treatment line for metastatic or inoperable breast cancer exceeding a duration of 1 month

Note:

Adjuvant endocrine treatment is not counted as one line.

Patients progressing on endocrine treatment: this specific endocrine treatment must have been stopped at least 2 weeks prior to randomization.

• Prior treatment with pertuzumab and/or T-DM1

• Known leptomeningeal or CNS metastases

Note:

A brain MRI or CT scan is mandatory in case of clinical suspicion of CNS metastases.

• Single bone metastasis treated with radiotherapy (if the bone metastasis is the only tumor lesion)

Inclusion criteria for second-line therapy • At least one dose of trial therapy in the first-line treatment phase of this trial

• • Proven disease progression on first-line therapy or radiotherapy of a bone metastasis

Notes:

First new parenchymal CNS metastases only do not count as progression requiring the initiation of second line trial treatment. Radiotherapy of a single area only for pain control is allowed and will not count as PD.

• Adequate organ function, evidenced by the following laboratory results: Neutrophils >1.5x109/L, platelets >100x109/L, hemoglobin ≥90g/L, total bilirubin ≤1.5xULN (unless the patients has documented Gilbert's disease), AST ≤3xULN, AP ≤2.5xULN (except in patients with bone metastases: AP ≤5xULN), creatinine ≤1.5ULN

• LVEF ≥50% as determined by either ECHO or MUGA

• QoL questionnaire has been completed.

Exclusion criteria for second-line therapy

• Termination of first-line therapy with trastuzumab/pertuzumab due to unacceptable toxicity without objective evidence of disease progression

• CNS metastases that are untreated, symptomatic, or require therapy to control symptoms, as well as a history of radiation, surgery, or other therapy, including steroids, to control symptoms from CNS metastases within 2 months (60 days) before registration

• Peripheral neuropathy of CTCAE grade ≥3

Interstitial lung disease (ILD) or pneumonitis grade ≥3
Any other adverse event which has not recovered to CTCAE grade ≤1 (except alopecia)",NA,NA,TRUE,FALSE,TRUE,"selection of patients (most important criteria)

inclusion criteria for first-line therapy

• histologically confirmed breast cancer with distant metastases

note:

a biopsy from the primary tumor or a metastasis can be used for diagnosis.
patients with non-measurable lesions are eligible.
patients with inoperable, locally advanced breast cancer with lymph node metastases other than ipsilateral locoregional (axillary, infraclavicular, parasternal) or other distant metastases are eligible.
patients with bone metastases with or without bone targeted therapy (bisphosphonates, denosumab) are eligible.

patients with de-novo stage iv disease are eligible.

her2-positive tumor according to central pathology testing for her2

note:

a formalin-fixed paraffin-embedded (ffpe) biopsy from the primary tumor or a metastasis has to be used for her2 status determination. if a biopsy is available from a metastasis, the her2 testing should be performed using the metastasis.

fine needle aspiration is not acceptable for her 2 testing. • women aged ≥18 years

• who performance status 0 to 2

left ventricular ejection fraction (lvef) ≥50% as determined by either echo or muga
adequate organ function, evidenced by the following laboratory results:

neutrophils >1.5x109/l, platelets >100x109/l, hemoglobin ≥90g/l, total bilirubin ≤1.5xuln (unless the patients has documented gilbert's disease), ast ≤3xuln, alt ≤3xuln, ap ≤2.5xuln (except in patients with bone metastases: ap ≤5xuln), creatinine ≤1.5xuln

exclusion criteria for first-line therapy

• prior chemotherapy for inoperable locally advanced or metastatic breast cancer

note:

prior neoadjuvant/adjuvant chemotherapy is allowed if doses for anthracyclines have not exceeded 720mg/m2 and 240mg/m2 for epirubicin and doxorubicin, respectively.

- re-exposure to paclitaxel is permitted, if the last dose of taxane was given at least 1 year before randomization.

- re-exposure to vinorelbine is permitted, if the last dose of vinorelbine was given at least 1 year before randomization.

prior anti-her2 treatment for metastatic or inoperable breast cancer

note:

prior neoadjuvant/adjuvant anti-her2 treatment with trastuzumab and/or lapatinib is allowed.

• more than one endocrine treatment line for metastatic or inoperable breast cancer exceeding a duration of 1 month

note:

adjuvant endocrine treatment is not counted as one line.

patients progressing on endocrine treatment: this specific endocrine treatment must have been stopped at least 2 weeks prior to randomization.

• prior treatment with pertuzumab and/or t-dm1

• known leptomeningeal or cns metastases

note:

a brain mri or ct scan is mandatory in case of clinical suspicion of cns metastases.

• single bone metastasis treated with radiotherapy (if the bone metastasis is the only tumor lesion)

inclusion criteria for second-line therapy • at least one dose of trial therapy in the first-line treatment phase of this trial

• • proven disease progression on first-line therapy or radiotherapy of a bone metastasis

notes:

first new parenchymal cns metastases only do not count as progression requiring the initiation of second line trial treatment. radiotherapy of a single area only for pain control is allowed and will not count as pd.

• adequate organ function, evidenced by the following laboratory results: neutrophils >1.5x109/l, platelets >100x109/l, hemoglobin ≥90g/l, total bilirubin ≤1.5xuln (unless the patients has documented gilbert's disease), ast ≤3xuln, ap ≤2.5xuln (except in patients with bone metastases: ap ≤5xuln), creatinine ≤1.5uln

• lvef ≥50% as determined by either echo or muga

• qol questionnaire has been completed.

exclusion criteria for second-line therapy

• termination of first-line therapy with trastuzumab/pertuzumab due to unacceptable toxicity without objective evidence of disease progression

• cns metastases that are untreated, symptomatic, or require therapy to control symptoms, as well as a history of radiation, surgery, or other therapy, including steroids, to control symptoms from cns metastases within 2 months (60 days) before registration

• peripheral neuropathy of ctcae grade ≥3

interstitial lung disease (ild) or pneumonitis grade ≥3
any other adverse event which has not recovered to ctcae grade ≤1 (except alopecia)",NA
345,NCT01837095,92513223,Metastatic Breast Cancer,metastatic breast cancer,53951139,NA,Female,18 Years,55 Years,No,NA,"Inclusion Criteria:

Histologically confirmed invasive cancer of the breast.
Presence of at least one measurable lesion per RECIST 1.1 criteria
Stage IV disease by AJCC criteria (7th edition).
HER2 negative (IHC 0,1 or FISH HER2:CEP17 ratio < 2.0)
Must have had treatment with at least 2 but no more than 3 previous regimens in the metastatic setting. Previous treatment must have included an anthracycline and taxane in either the adjuvant or metastatic setting.
At least 21 days from the completion of any previous cytotoxic chemotherapy or biological therapy at time of initiation of POL6326.
ECOG performance status < 2

Exclusion Criteria:

Previously received eribulin.
Peripheral neuropathy > Grade 2.
Receipt of any other investigational agent within the 28 days prior to Day 1.
Receipt of colony stimulating factor filgrastim, pegfilgrastim, or sargramostim within 14 days prior to Day 1.
Radiation therapy within the 14 days prior to Day 1.
Severe concurrent illness or psychiatric illness/social situation that would limit compliance with study requirements.
History of other malignancy ≤ 5 years previous with the exception of basal cell or squamous cell carcinoma of the skin which were treated with local resection only or carcinoma in situ of the cervix.
Pregnant or breastfeeding.
Known HIV positivity on combination antiretroviral therapy; these patients are at increased risk of lethal infections when treated with marrow-suppressive therapy",NA,NA,TRUE,FALSE,FALSE,"histologically confirmed invasive cancer of the breast.
presence of at least one measurable lesion per recist 1.1 criteria
stage iv disease by ajcc criteria (7th edition).
her2 negative (ihc 0,1 or fish her2:cep17 ratio < 2.0)
must have had treatment with at least 2 but no more than 3 previous regimens in the metastatic setting. previous treatment must have included an anthracycline and taxane in either the adjuvant or metastatic setting.
at least 21 days from the completion of any previous cytotoxic chemotherapy or biological therapy at time of initiation of pol6326.
ecog performance status < 2","

previously received eribulin.
peripheral neuropathy > grade 2.
receipt of any other investigational agent within the 28 days prior to day 1.
receipt of colony stimulating factor filgrastim, pegfilgrastim, or sargramostim within 14 days prior to day 1.
radiation therapy within the 14 days prior to day 1.
severe concurrent illness or psychiatric illness/social situation that would limit compliance with study requirements.
history of other malignancy ≤ 5 years previous with the exception of basal cell or squamous cell carcinoma of the skin which were treated with local resection only or carcinoma in situ of the cervix.
pregnant or breastfeeding.
known hiv positivity on combination antiretroviral therapy; these patients are at increased risk of lethal infections when treated with marrow-suppressive therapy"
347,NCT01840293,92679069,Recurrent/Metastatic Breast Cancer,recurrent/metastatic breast cancer,54043492,Non-Probability Sample,Female,18 Years,N/A,No,"All newly diagnosed breast cancer patients, recurrent and stage IV metastatic breast cancer patients.","Inclusion Criteria:

Patients diagnosed with primary breast cancer attending hospital for the resection of their tumour tissue

Or

-Patients with suspected or confirmed recurrent or metastatic breast cancer (Patient has a history of a biopsy- or surgically- (i.e. pathologically) confirmed primary breast cancer) attending hospital for the resection/biopsy and/or treatment of tumour tissue

Or

-Patient with suspected (but not necessarily biopsy confirmed) newly diagnosed stage 4 breast cancer attending hospital for the resection/biopsy and/or treatment of their tumour tissue

Patients receiving neoadjuvant treatment are also eligible (if applicable)
Patients have to be ≥ 18 years of age
Patients must be able to give informed consent",NA,NA,TRUE,FALSE,TRUE,"patients diagnosed with primary breast cancer attending hospital for the resection of their tumour tissue

or

-patients with suspected or confirmed recurrent or metastatic breast cancer (patient has a history of a biopsy- or surgically- (i.e. pathologically) confirmed primary breast cancer) attending hospital for the resection/biopsy and/or treatment of tumour tissue

or

-patient with suspected (but not necessarily biopsy confirmed) newly diagnosed stage 4 breast cancer attending hospital for the resection/biopsy and/or treatment of their tumour tissue

patients receiving neoadjuvant treatment are also eligible (if applicable)
patients have to be ≥ 18 years of age
patients must be able to give informed consent",NA
348,NCT01843725,92690719,Metastatic Breast Cancers,metastatic breast cancers,54050850,NA,All,18 Years,N/A,No,NA,"Inclusion Criteria:

Histologically confirmed digestive or breast cancer that is metastatic or unresectable, for which no curative measures are possible, and chemorefractory to all known medications in the respective fields.
Age ≥ 18 years.
Life expectancy of greater than 12 weeks.
ECOG (Eastern Cooperative Oncology Group) performance status ≤ 1.

Normal organ and marrow function as defined below:

Leukocytes > 3,000/microLiter (mcL)
Hb>10g/mcL
Absolute neutrophil count > 1,500/mcL
Platelets > 100,000/mcL
Total bilirubin within 2 × institutional upper limit of normal
AST (aspartate amino transferase)/ALT (alanine amino transferase)/ALKP (Alkaline Phosphatase) levels < 5 × institutional upper limit of normal for liver metastases, < 2.5 ULN (Upper Limit of Normal) in case of no liver metastases
Creatinine within 2 × institutional upper limit of normal or creatinine clearance > 35 mL/min
Women of childbearing potential and men must agree to use adequate contraception (hormonal or barrier method of birth control, abstinence) prior to study entry and for the duration of study participation. Should a woman become pregnant or suspect she is pregnant while participating in this study, she should inform her treating physician immediately.
Signed written informed consent (approved by an Independent Ethics Committee (IEC)) obtained prior to any study specific baseline procedures.

Exclusion Criteria:

Patients with malabsorption or dysfunctional GI tract.
Participants who have had chemotherapy or radiotherapy (except limited radiotherapy for bone metastasis for instance) within 4 weeks prior to entering the study or those who have not recovered from adverse events due to agents administered more than 4 weeks earlier.
Participants should not receive any other experimental agents.

Participants with known brain metastases should be excluded from this clinical trial because of their poor prognosis and because they often develop progressive neurologic dysfunction that would confound the evaluation of neurologic and other adverse events.

History of cardiovascular ischemic disease or cerebrovascular incident within the last six months, NYHA class III and IV congestive heart failure.
Intolerance to atropine sulfate or loperamide
Known dihydropyrimidine dehydrogenase deficiency
Treatment with CYP3A4 inducers unless discontinued > 7 days prior to randomization
Any of the following in 3 months prior to inclusion: grade 3-4 gastrointestinal bleeding (unless due to resected tumor), treatment resistant peptic ulcer disease, erosive esophagitis or gastritis, infectious or inflammatory bowel disease, or diverticulitis.
Major surgery within 6 weeks.
Uncontrolled concurrent illness including, but not limited to ongoing or active infection, symptomatic congestive heart failure, unstable angina pectoris, cardiac arrhythmia, or psychiatric illness/social situations that would limit compliance with study requirements.
Pregnant women, lactation or refusal to use adequate contraceptive measures (hormonal or barrier method of birth control, abstinence).",NA,NA,TRUE,FALSE,TRUE,"histologically confirmed digestive or breast cancer that is metastatic or unresectable, for which no curative measures are possible, and chemorefractory to all known medications in the respective fields.
age ≥ 18 years.
life expectancy of greater than 12 weeks.
ecog (eastern cooperative oncology group) performance status ≤ 1.

normal organ and marrow function as defined below:

leukocytes > 3,000/microliter (mcl)
hb>10g/mcl
absolute neutrophil count > 1,500/mcl
platelets > 100,000/mcl
total bilirubin within 2 × institutional upper limit of normal
ast (aspartate amino transferase)/alt (alanine amino transferase)/alkp (alkaline phosphatase) levels < 5 × institutional upper limit of normal for liver metastases, < 2.5 uln (upper limit of normal) in case of no liver metastases
creatinine within 2 × institutional upper limit of normal or creatinine clearance > 35 ml/min
women of childbearing potential and men must agree to use adequate contraception (hormonal or barrier method of birth control, abstinence) prior to study entry and for the duration of study participation. should a woman become pregnant or suspect she is pregnant while participating in this study, she should inform her treating physician immediately.
signed written informed consent (approved by an independent ethics committee (iec)) obtained prior to any study specific baseline procedures.","

patients with malabsorption or dysfunctional gi tract.
participants who have had chemotherapy or radiotherapy (except limited radiotherapy for bone metastasis for instance) within 4 weeks prior to entering the study or those who have not recovered from adverse events due to agents administered more than 4 weeks earlier.
participants should not receive any other experimental agents.

participants with known brain metastases should be excluded from this clinical trial because of their poor prognosis and because they often develop progressive neurologic dysfunction that would confound the evaluation of neurologic and other adverse events.

history of cardiovascular ischemic disease or cerebrovascular incident within the last six months, nyha class iii and iv congestive heart failure.
intolerance to atropine sulfate or loperamide
known dihydropyrimidine dehydrogenase deficiency
treatment with cyp3a4 inducers unless discontinued > 7 days prior to randomization
any of the following in 3 months prior to inclusion: grade 3-4 gastrointestinal bleeding (unless due to resected tumor), treatment resistant peptic ulcer disease, erosive esophagitis or gastritis, infectious or inflammatory bowel disease, or diverticulitis.
major surgery within 6 weeks.
uncontrolled concurrent illness including, but not limited to ongoing or active infection, symptomatic congestive heart failure, unstable angina pectoris, cardiac arrhythmia, or psychiatric illness/social situations that would limit compliance with study requirements.
pregnant women, lactation or refusal to use adequate contraceptive measures (hormonal or barrier method of birth control, abstinence)."
