,nct_id,id.x,name,downcase_name,id.y,sampling_method,gender,minimum_age,maximum_age,healthy_volunteers,population,criteria,gender_description,gender_based,adult,child,older_adult,inclusion_criteria,exclusion_criteria
360,NCT01912963,92454293,Metastatic Breast Cancer,metastatic breast cancer,53918052,NA,All,18 Years,N/A,No,NA,"Inclusion Criteria:

Participants must meet the following criteria on screening examination to be eligible to participate in the study:

- Participants must have invasive primary tumor or metastatic tissue confirmation of human epidermal growth factor receptor 2 (HER2)-positive status, defined as presence of one or more of the following criteria: Over-expression by immunohistochemistry (IHC) with score of 3+ AND/OR HER2 gene amplification (> 6 HER2 gene copies per nucleus or a FISH ratio [HER2 gene copies to chromosome 17 signals] of ≥ 2.0) Note: Participants with a negative or equivocal overall result (FISH ratio of <2.0 or ≤ 6.0 HER2 gene copies per nucleus) and IHC staining scores of 0, 1+, 2+ are not eligible for enrollment.

Participants must have metastatic, unresectable locally advanced, or locally recurrent HER2-positive breast cancer. For the phase II portion of the study, it is required that participants have measurable disease, as defined by RECIST 1.1, which can be accurately evaluated on computerized tomography (CT) or magnetic resonance (MRI). Measurable disease is defined as: at least one lesion of >10 mm in the longest diameter for a non-lymph node or >15 mm in the short-axis diameter for a lymph node which is serially measurable according to RECIST 1.1.criteria.1
Participants must have received at least 1 line of chemotherapy for advanced or metastatic breast cancer and/or relapse/progressed while on or within 6 months of completion of neoadjuvant or adjuvant trastuzumab. Prior pertuzumab is allowed in the phase II portion of the trial.
Participants must have had prior trastuzumab therapy (either in the adjuvant or metastatic setting).
Participants must be at least 2 weeks out from prior endocrine therapy, chemotherapy,radiotherapy, or other cancer-directed therapy (including novel agents), with adequate recovery of toxicity to baseline, or grade ≤1, with the exception of alopecia and hot flashes. Participants may have initiated bisphosphonate/denosumab therapy prior to start of protocol therapy. Biphosphonate/denosumab therapy may continue during protocol treatment. Such participants will have bone lesions considered evaluable for progression. Washout for trastuzumab is not necessary.
Women and men, age 18 years at the time of informed consent.
Participants must have an Eastern Cooperative Oncology Group (ECOG) performance status 0-1 or a Karnofsky Performance Scale (KP) 70%.
Participants must have normal organ and marrow function as defined below:
Absolute neutrophil count > 1,500/mcL
Platelets > 75,000/mcL
Hemoglobin >9g/dl
Total bilirubin ≤2.0 X institutional upper limit of normal
Aspartate Aminotransferase (AST, SGOT)/ALT(Alanine Aminotransferase, SGPT) ≤ 3 X institutional ULN without liver metastases, or ≤ 5 times institutional upper limit normal (ULN) with liver metastases (if liver metastases felt to be cause of Liver function tests (LFT) abnormalities)
Alkaline phosphatase (ALP) ≤3 x institutional upper limit of normal If total ALP is >3x institutional upper limit normal (in the absence of liver metastasis) or >5x institutional upper limit of normal (in subjects with liver metastasis) AND the subject is known to have bone metastases, then liver ALP isoenzyme should be used to assess liver function rather than total ALP.
Creatinine 2.0 mg/dL or creatinine clearance ≥50 mL/min.
left ventricular ejection fraction (LVEF) ≥50%, as determined by radionucleoventilugrams (RVG) (multi-gated acquisition-MUGA) or Echocardiogram (ECHO) within 60 days prior to initiation of protocol therapy.
Adequate IV access
The effects of eribulin mesylate, trastuzumab, and pertuzumab on the developing human fetus are unknown. Pre-clinical data was suggestive of a teratogenic effect of eribulin mesylate. Pertuzumab caused oligohydramnios, delayed renal development and embryo-fetal deaths in pregnant cynomolgus monkeys. In the post-marketing setting, cases of oligohydramnios, some associated with fatal pulmonary hypoplasia of the fetus have been reported in pregnant women receiving trastuzumab. For these reasons women of child bearing potential and men must agree to use adequate contraception (hormonal or barrier method of birth control; abstinence) prior to study entry and for the duration of study participation. Should a woman become pregnant or suspect she is pregnant while participating in this study, she should inform her treating physician immediately.
Ability to understand and willingness to sign a written informed consent document (approved by Institutional review board or independent ethics committee) obtained prior to any study procedure, with the understanding that the subject may withdraw at any time without prejudice.
Laboratory tests required for eligibility must be completed within 14 days prior study entry. Baseline tumor measurements must be documented from tests within 28 days of study entry. Other non-laboratory tests must be performed within 28 days of study entry.
For the Phase 2 portion of the study; patients must have tissue that is amenable to biopsy and must be willing to undergo research biopsy.

Exclusion Criteria: - Participants who exhibit any of the following conditions at screening will not be eligible for admission into the study:

Participants receiving any other study agents.
Participants receiving any other cancer directed concurrent therapy; such as concurrent chemotherapy, radiotherapy, or hormonal therapy. Concurrent treatment with biphosphonates/denosumab is allowed but should be started before starting treatment on study.
Active brain metastases: Participants with previously diagnosed brain metastases are eligible if they have completed treatment at least one month prior to enrollment, are neurologically stable, and have recovery from effects of radiotherapy or surgery.
History of allergic reaction attributed to compounds of similar chemical or biologic composition to eribulin mesylate, trastuzumab or pertuzumab, which cannot be managed by premedication.
Participants who previously received eribulin mesylate are not eligible for enrollment on the phase II portion.
Prior chemotherapy, targeted therapy, hormonal therapy, or radiation therapy (including any investigational agents) within 2 weeks prior entering the study or those who have not recovered adequately from adverse events (AEs) due to agents administered more than 4 weeks earlier (excluding alopecia and hot flashes). A washout period is not necessary for trastuzumab (or pertuzumab for run-in patients when applicable).
A baseline corrected QT interval of > 470 ms.
Pre-existing neuropathy ≥ grade 2 (NCI Common Toxicity Criteria for Adverse Events (CTCAE) Version 4.0)
Uncontrolled intercurrent illness including, not limited to ongoing or active infection, symptomatic congestive heart failure, unstable angina pectoris, cardiac arrhythmia, or psychiatric illness/social situations that would limit compliance with study requirements or other significant diseases or disorders that, in the investigator's opinion, would exclude the subject from participating in the study
Symptomatic intrinsic lung disease or extensive tumor involvement of the lungs, resulting in grade 2 or higher dyspnea at rest.
Currently pregnant or breast-feeding. All females must have a negative serum or urine pregnancy test (minimum sensitivity 25 IU/L or equivalent units of β-Human Chorionic Gonadotropin (β-Hcg) at the Baseline visit [within 7 days of the first dose of study treatment]). Females of childbearing potential must agree to use a medically acceptable method of contraception (e.g., abstinence, an intrauterine device, a double-barrier method such as condom + spermicidal or condom + diaphragm with spermicidal, a contraceptive implant, an oral contraceptive or have a vasectomized partner with confirmed azoospermia) throughout the entire study period and for 30 days after discontinuation of study treatment. The only subjects who will be exempt from this requirement are postmenopausal women (defined as women who have been amenorrheic for at least 12 consecutive months, in the appropriate age group, without other known or suspected primary cause) or subjects who have been sterilized surgically or who are otherwise proven sterile (i.e., bilateral tubal ligation with surgery at least 1 month before start of study treatment, hysterectomy, or bilateral oophorectomy with surgery at least 1 month before start of study treatment). Current, ongoing protocols containing pertuzumab have included continuous pregnancy monitoring during the trial and for six months after the last dose of study drug is administered. Because of the long half-life of pertuzumab, women should be warned not to become pregnant for at least six months after completion of treatment.
Individuals with a history of different malignancy are ineligible except for the following circumstances. Individuals with a history of other malignancies are eligible if they have been disease-free for at least 5 years and are deemed by the investigator to be at low risk for recurrence of that malignancy. Individuals with the following cancers are eligible if diagnosed and treated within the past 5 years: cervical cancer in situ, and non-melanoma cancer of the skin.",NA,NA,TRUE,FALSE,TRUE,"participants must meet the following criteria on screening examination to be eligible to participate in the study:

- participants must have invasive primary tumor or metastatic tissue confirmation of human epidermal growth factor receptor 2 (her2)-positive status, defined as presence of one or more of the following criteria: over-expression by immunohistochemistry (ihc) with score of 3+ and/or her2 gene amplification (> 6 her2 gene copies per nucleus or a fish ratio [her2 gene copies to chromosome 17 signals] of ≥ 2.0) note: participants with a negative or equivocal overall result (fish ratio of <2.0 or ≤ 6.0 her2 gene copies per nucleus) and ihc staining scores of 0, 1+, 2+ are not eligible for enrollment.

participants must have metastatic, unresectable locally advanced, or locally recurrent her2-positive breast cancer. for the phase ii portion of the study, it is required that participants have measurable disease, as defined by recist 1.1, which can be accurately evaluated on computerized tomography (ct) or magnetic resonance (mri). measurable disease is defined as: at least one lesion of >10 mm in the longest diameter for a non-lymph node or >15 mm in the short-axis diameter for a lymph node which is serially measurable according to recist 1.1.criteria.1
participants must have received at least 1 line of chemotherapy for advanced or metastatic breast cancer and/or relapse/progressed while on or within 6 months of completion of neoadjuvant or adjuvant trastuzumab. prior pertuzumab is allowed in the phase ii portion of the trial.
participants must have had prior trastuzumab therapy (either in the adjuvant or metastatic setting).
participants must be at least 2 weeks out from prior endocrine therapy, chemotherapy,radiotherapy, or other cancer-directed therapy (including novel agents), with adequate recovery of toxicity to baseline, or grade ≤1, with the exception of alopecia and hot flashes. participants may have initiated bisphosphonate/denosumab therapy prior to start of protocol therapy. biphosphonate/denosumab therapy may continue during protocol treatment. such participants will have bone lesions considered evaluable for progression. washout for trastuzumab is not necessary.
women and men, age 18 years at the time of informed consent.
participants must have an eastern cooperative oncology group (ecog) performance status 0-1 or a karnofsky performance scale (kp) 70%.
participants must have normal organ and marrow function as defined below:
absolute neutrophil count > 1,500/mcl
platelets > 75,000/mcl
hemoglobin >9g/dl
total bilirubin ≤2.0 x institutional upper limit of normal
aspartate aminotransferase (ast, sgot)/alt(alanine aminotransferase, sgpt) ≤ 3 x institutional uln without liver metastases, or ≤ 5 times institutional upper limit normal (uln) with liver metastases (if liver metastases felt to be cause of liver function tests (lft) abnormalities)
alkaline phosphatase (alp) ≤3 x institutional upper limit of normal if total alp is >3x institutional upper limit normal (in the absence of liver metastasis) or >5x institutional upper limit of normal (in subjects with liver metastasis) and the subject is known to have bone metastases, then liver alp isoenzyme should be used to assess liver function rather than total alp.
creatinine 2.0 mg/dl or creatinine clearance ≥50 ml/min.
left ventricular ejection fraction (lvef) ≥50%, as determined by radionucleoventilugrams (rvg) (multi-gated acquisition-muga) or echocardiogram (echo) within 60 days prior to initiation of protocol therapy.
adequate iv access
the effects of eribulin mesylate, trastuzumab, and pertuzumab on the developing human fetus are unknown. pre-clinical data was suggestive of a teratogenic effect of eribulin mesylate. pertuzumab caused oligohydramnios, delayed renal development and embryo-fetal deaths in pregnant cynomolgus monkeys. in the post-marketing setting, cases of oligohydramnios, some associated with fatal pulmonary hypoplasia of the fetus have been reported in pregnant women receiving trastuzumab. for these reasons women of child bearing potential and men must agree to use adequate contraception (hormonal or barrier method of birth control; abstinence) prior to study entry and for the duration of study participation. should a woman become pregnant or suspect she is pregnant while participating in this study, she should inform her treating physician immediately.
ability to understand and willingness to sign a written informed consent document (approved by institutional review board or independent ethics committee) obtained prior to any study procedure, with the understanding that the subject may withdraw at any time without prejudice.
laboratory tests required for eligibility must be completed within 14 days prior study entry. baseline tumor measurements must be documented from tests within 28 days of study entry. other non-laboratory tests must be performed within 28 days of study entry.
for the phase 2 portion of the study; patients must have tissue that is amenable to biopsy and must be willing to undergo research biopsy."," - participants who exhibit any of the following conditions at screening will not be eligible for admission into the study:

participants receiving any other study agents.
participants receiving any other cancer directed concurrent therapy; such as concurrent chemotherapy, radiotherapy, or hormonal therapy. concurrent treatment with biphosphonates/denosumab is allowed but should be started before starting treatment on study.
active brain metastases: participants with previously diagnosed brain metastases are eligible if they have completed treatment at least one month prior to enrollment, are neurologically stable, and have recovery from effects of radiotherapy or surgery.
history of allergic reaction attributed to compounds of similar chemical or biologic composition to eribulin mesylate, trastuzumab or pertuzumab, which cannot be managed by premedication.
participants who previously received eribulin mesylate are not eligible for enrollment on the phase ii portion.
prior chemotherapy, targeted therapy, hormonal therapy, or radiation therapy (including any investigational agents) within 2 weeks prior entering the study or those who have not recovered adequately from adverse events (aes) due to agents administered more than 4 weeks earlier (excluding alopecia and hot flashes). a washout period is not necessary for trastuzumab (or pertuzumab for run-in patients when applicable).
a baseline corrected qt interval of > 470 ms.
pre-existing neuropathy ≥ grade 2 (nci common toxicity criteria for adverse events (ctcae) version 4.0)
uncontrolled intercurrent illness including, not limited to ongoing or active infection, symptomatic congestive heart failure, unstable angina pectoris, cardiac arrhythmia, or psychiatric illness/social situations that would limit compliance with study requirements or other significant diseases or disorders that, in the investigator's opinion, would exclude the subject from participating in the study
symptomatic intrinsic lung disease or extensive tumor involvement of the lungs, resulting in grade 2 or higher dyspnea at rest.
currently pregnant or breast-feeding. all females must have a negative serum or urine pregnancy test (minimum sensitivity 25 iu/l or equivalent units of β-human chorionic gonadotropin (β-hcg) at the baseline visit [within 7 days of the first dose of study treatment]). females of childbearing potential must agree to use a medically acceptable method of contraception (e.g., abstinence, an intrauterine device, a double-barrier method such as condom + spermicidal or condom + diaphragm with spermicidal, a contraceptive implant, an oral contraceptive or have a vasectomized partner with confirmed azoospermia) throughout the entire study period and for 30 days after discontinuation of study treatment. the only subjects who will be exempt from this requirement are postmenopausal women (defined as women who have been amenorrheic for at least 12 consecutive months, in the appropriate age group, without other known or suspected primary cause) or subjects who have been sterilized surgically or who are otherwise proven sterile (i.e., bilateral tubal ligation with surgery at least 1 month before start of study treatment, hysterectomy, or bilateral oophorectomy with surgery at least 1 month before start of study treatment). current, ongoing protocols containing pertuzumab have included continuous pregnancy monitoring during the trial and for six months after the last dose of study drug is administered. because of the long half-life of pertuzumab, women should be warned not to become pregnant for at least six months after completion of treatment.
individuals with a history of different malignancy are ineligible except for the following circumstances. individuals with a history of other malignancies are eligible if they have been disease-free for at least 5 years and are deemed by the investigator to be at low risk for recurrence of that malignancy. individuals with the following cancers are eligible if diagnosed and treated within the past 5 years: cervical cancer in situ, and non-melanoma cancer of the skin."
361,NCT01919749,92047671,Metastatic Breast Cancer,metastatic breast cancer,53682830,NA,All,18 Years,N/A,No,NA,"Inclusion Criteria:

Understand and provide written informed consent and HIPAA Authorization prior to initiation of any study-specific procedures
Have a life expectancy > 3 months
Have a diagnosis of metastatic breast cancer with measurable disease (RECIST 1.1)
Have progressed on ≥ 1 prior chemotherapeutic and/or hormonal regimen for advanced disease.
Have documentation of progression (by RECIST 1.1) on the treatment regimen immediately prior to entering this study
Be ≥ 18 years of age
Have a ECOG score of 0-1
Be a good medical candidate for and willing to undergo a biopsy or surgical procedures to obtain tissue, which may or may not be part of the patient's routine care for their malignancy. The requirements for the amount of tissue required for analysis are detailed in Section 6.2.2.
Have been off their prior regimen for ≥ 3 weeks or 5 x half-life of drug, whichever is shorter and have recovered from the side effects (≤ grade 1) of that regimen
Have adequate organ and bone marrow function
Female patients of childbearing potential must have a negative pregnancy test and agree to use at least one form of contraception during the study and for at least one month after treatment discontinuation. For the purposes of this study, child-bearing potential is defined as: all female patients that were not in post-menopause for at least one year or are surgically sterile
Male patients must use a form of barrier contraception approved by the investigator / treating physician during the study and for at least one month after treatment discontinuation.

Exclusion Criteria:

Have a tumor biopsy intended for use in the current study that was performed more than 2 months prior to analysis
Have metastatic lesion that is not accessible to biopsy
Had > 6 months treatment under the last line of therapy
Have interventional cancer therapy conducted after the biopsy was collected prior to analysis
Have symptomatic CNS metastasis. Patients with a history of CNS metastases who have been treated with whole brain irradiation must be stable without symptoms for 4 weeks after completion of treatment, with image documentation required, and must be either off steroids or on a stable dose of steroids for ≥ 2 weeks prior to enrollment
Have any previous history of another malignancy (other than cured basal cell carcinoma of the skin or cured in-situ carcinoma of the cervix) within 5 years of study entry
Have uncontrolled concurrent illness including, but not limited to, ongoing or active serious infection, symptomatic congestive heart failure, unstable angina pectoris, unstable cardiac arrhythmias, psychiatric illness, or situations that would limit compliance with the study requirements or the ability to willingly give written informed consent
Have known HIV, HBV, HCV infection
Are pregnant or breast-feeding patients or any patient with childbearing potential not using adequate contraception.",NA,NA,TRUE,FALSE,TRUE,"understand and provide written informed consent and hipaa authorization prior to initiation of any study-specific procedures
have a life expectancy > 3 months
have a diagnosis of metastatic breast cancer with measurable disease (recist 1.1)
have progressed on ≥ 1 prior chemotherapeutic and/or hormonal regimen for advanced disease.
have documentation of progression (by recist 1.1) on the treatment regimen immediately prior to entering this study
be ≥ 18 years of age
have a ecog score of 0-1
be a good medical candidate for and willing to undergo a biopsy or surgical procedures to obtain tissue, which may or may not be part of the patient's routine care for their malignancy. the requirements for the amount of tissue required for analysis are detailed in section 6.2.2.
have been off their prior regimen for ≥ 3 weeks or 5 x half-life of drug, whichever is shorter and have recovered from the side effects (≤ grade 1) of that regimen
have adequate organ and bone marrow function
female patients of childbearing potential must have a negative pregnancy test and agree to use at least one form of contraception during the study and for at least one month after treatment discontinuation. for the purposes of this study, child-bearing potential is defined as: all female patients that were not in post-menopause for at least one year or are surgically sterile
male patients must use a form of barrier contraception approved by the investigator / treating physician during the study and for at least one month after treatment discontinuation.","

have a tumor biopsy intended for use in the current study that was performed more than 2 months prior to analysis
have metastatic lesion that is not accessible to biopsy
had > 6 months treatment under the last line of therapy
have interventional cancer therapy conducted after the biopsy was collected prior to analysis
have symptomatic cns metastasis. patients with a history of cns metastases who have been treated with whole brain irradiation must be stable without symptoms for 4 weeks after completion of treatment, with image documentation required, and must be either off steroids or on a stable dose of steroids for ≥ 2 weeks prior to enrollment
have any previous history of another malignancy (other than cured basal cell carcinoma of the skin or cured in-situ carcinoma of the cervix) within 5 years of study entry
have uncontrolled concurrent illness including, but not limited to, ongoing or active serious infection, symptomatic congestive heart failure, unstable angina pectoris, unstable cardiac arrhythmias, psychiatric illness, or situations that would limit compliance with the study requirements or the ability to willingly give written informed consent
have known hiv, hbv, hcv infection
are pregnant or breast-feeding patients or any patient with childbearing potential not using adequate contraception."
