,nct_id,id.x,name,downcase_name,id.y,sampling_method,gender,minimum_age,maximum_age,healthy_volunteers,population,criteria,gender_description,gender_based,adult,child,older_adult,inclusion_criteria,exclusion_criteria
354,NCT01862900,92692293,Metastatic Breast Cancer,metastatic breast cancer,54051839,NA,All,18 Years,N/A,No,NA,"Inclusion Criteria:

Histologically confirmed breast cancer with clinical evidence of stage 4 disease
Measurable disease and at least one lesion in either liver or lung that is amenable to stereotactic body radiation
One site of disease that will not receive radiation
Patients with hormone receptor positive breast cancer must have received prior anti-hormonal therapy for metastatic disease and have progressed and patients with hormone receptor negative breast cancer must have received at least one prior chemotherapy regimen and progressed.
Eastern Cooperative Oncology Group (ECOG) performance status 0, 1, or 2.
Women of childbearing potential must have a negative pregnancy test on the day treatment starts and must avoid becoming pregnant while on treatment. Men must avoid fathering a child while on treatment.
Patients must have blood test results within pre-specified range
No active bleeding
No clinical coagulopathy (INR <1.5, PT <16 seconds, PTT < 38 seconds) within 28 days
Anticipated lifespan greater than 12 weeks

Exclusion Criteria:

Active infection requiring systemic antibiotics.
Active autoimmune disease as defined by the autoimmune disease assessment tool.
Previous treatment with mouse monoclonal antibodies
At least 28 days since prior chemotherapy or monoclonal antibody therapy (trastuzumab or bevacizumab). Patients who have been on hormonal therapy can continue on therapy at the discretion of the investigator. Bisphosphonate therapy is acceptable during study participation.
Diagnosis of a solid tumor malignancy (excluding non-melanoma skin cancer) within 3 years of enrollment.
Need for chronic maintenance oral steroids.
Active brain metastatic disease. Treated brain metastases with surgery, gamma-knife radiosurgery or radiation and stable for at least 4 weeks and off steroids are eligible.
No metastatic site amenable to SBRT
Pregnant or lactating women, as treatment involves risks to the embryo or fetus.
Other medical or psychiatric conditions that in the opinion of the Principal Investigator would preclude safe participation in protocol.",NA,NA,TRUE,FALSE,TRUE,"histologically confirmed breast cancer with clinical evidence of stage 4 disease
measurable disease and at least one lesion in either liver or lung that is amenable to stereotactic body radiation
one site of disease that will not receive radiation
patients with hormone receptor positive breast cancer must have received prior anti-hormonal therapy for metastatic disease and have progressed and patients with hormone receptor negative breast cancer must have received at least one prior chemotherapy regimen and progressed.
eastern cooperative oncology group (ecog) performance status 0, 1, or 2.
women of childbearing potential must have a negative pregnancy test on the day treatment starts and must avoid becoming pregnant while on treatment. men must avoid fathering a child while on treatment.
patients must have blood test results within pre-specified range
no active bleeding
no clinical coagulopathy (inr <1.5, pt <16 seconds, ptt < 38 seconds) within 28 days
anticipated lifespan greater than 12 weeks","

active infection requiring systemic antibiotics.
active autoimmune disease as defined by the autoimmune disease assessment tool.
previous treatment with mouse monoclonal antibodies
at least 28 days since prior chemotherapy or monoclonal antibody therapy (trastuzumab or bevacizumab). patients who have been on hormonal therapy can continue on therapy at the discretion of the investigator. bisphosphonate therapy is acceptable during study participation.
diagnosis of a solid tumor malignancy (excluding non-melanoma skin cancer) within 3 years of enrollment.
need for chronic maintenance oral steroids.
active brain metastatic disease. treated brain metastases with surgery, gamma-knife radiosurgery or radiation and stable for at least 4 weeks and off steroids are eligible.
no metastatic site amenable to sbrt
pregnant or lactating women, as treatment involves risks to the embryo or fetus.
other medical or psychiatric conditions that in the opinion of the principal investigator would preclude safe participation in protocol."
355,NCT01881230,92456273,Triple-negative Metastatic Breast Cancer,triple-negative metastatic breast cancer,53919059,NA,Female,18 Years,N/A,No,NA,"Inclusion Criteria: A subject will be eligible for inclusion in this study only if all of the following criteria are met:

Female subjects, age ≥ 18 years at the time informed consent is signed
Pathologically confirmed adenocarcinoma of the breast

Pathologically confirmed as triple negative, source documented, defined as both of the following

Estrogen Receptor (ER) and Progesterone Receptor (PgR) negative: < 1% of tumor cell nuclei are immunoreactive in the presence of evidence that the sample can express ER or PgR (positive intrinsic controls)
Human Epidermal Growth Factor Receptor 2 (HER2) negative as per American Society of Clinical Oncology - College of American Pathologists (ASCO/CAP) guidelines i. Immunohistochemistry (IHC) 0 or 1 Fluorescence In Situ Hybridization (FISH) negative (or equivalent negative test). Subjects with IHC 2 must have a negative by Fluorescence In Situ Hybridization (FISH),, (or equivalent negative test).
Subjects with prior breast cancer history of different phenotypes (ie, ER/PgR/HER2 positive) must have pathologic confirmation of triple negative disease in at least one of the current sites of metastasis

Subjects must have received prior adjuvant or neoadjuvant anthracycline therapy; unless (a) anthracycline treatment was not indicated or was not the best treatment option for the subject in the opinion of the treating physician; and (b) anthracycline treatment remains not indicated or, in the opinion of the treating physician, is not the best treatment option for the subject's metastatic disease.

a. Newly diagnosed subjects presenting with TNMBC are eligible for the study if anthracycline treatment is not indicated or is not the best treatment option for the subject in the opinion of the treating physician.

Subjects with measurable metastatic disease, defined by Response Evaluation Criteria in Solid Tumors 1.1 (RECIST 1.1) guidelines
Life expectancy ≥ 16 weeks from randomization
No prior cytotoxic chemotherapy for metastatic breast cancer. Prior immunotherapy and/or monoclonal antibody therapy are acceptable. Prior treatments must have been discontinued at least 30 days prior to start of study treatment and all related toxicities must have resolved to Grade 1 or less.

Prior neoadjuvant or adjuvant chemotherapy, if given, must have been completed at least 6 months before randomization with all related toxicities resolved, and documented evidence of disease progression per RECIST 1.1 guidelines is required.

a. If prior neoadjuvant or adjuvant chemotherapy contained taxane, gemcitabine, or platinum agents, the treatment must have completed at least 12 months before randomization

Prior radiotherapy must have completed before randomization, with full recovery from acute radiation side effects. At least one measurable lesion must be completely outside the radiation portal or there must be unequivocal radiologic or clinical exam proof of progressive disease within the radiation portal, in accordance with RECIST 1.1 guidelines
At least 30 days from major surgery before randomization, with full recovery
Eastern Cooperative Oncology Group (ECOG) performance status 0-1

Subject has the following blood counts at screening:

Absolute Neutrophil Count (ANC) ≥ 1500/mm^2 ;
Platelets ≥ 100,000/mm^2 ;
Hemoglobin (Hgb) ≥ 9 g/dL

Subject has the following blood chemistry levels at screening:

Aspartate aminotransferase (AST) Serum glutamic-oxaloacetic transaminase (SGOT), Alanine Aminotransferase (ALT ) Serum Glutamic Pyruvate Transaminase (SGPT) ≤ 2.5 x upper limit of normal range (ULN); if hepatic metastases present ≤ 5.0 x ULN
Total serum bilirubin ≤ ULN; or total bilirubin ≤ 3.0 × ULN with direct bilirubin within normal range in subjects with documented Gilbert's Syndrome
Creatinine clearance > 60 mL/min (by Cockcroft-Gault)

Females of child-bearing potential [defined as a sexually mature women who (1) have not undergone hysterectomy (the surgical removal of the uterus) or bilateral oophorectomy (the surgical removal of both ovaries) or (2) have not been naturally postmenopausal for at least 24 consecutive months (i.e., has had menses at any time during the preceding 24 consecutive months)] must:

Demonstrate a negative serum pregnancy test result at screening (performed by central lab) confirmed by local negative urine pregnancy dipstick within 72 hours prior to the first dose of IP); pregnancy test with sensitivity of at least 25 mIU/mL; and
Either commit to true abstinence* from heterosexual contact (which must be reviewed on a monthly basis) or agree to use, and be able to comply with, two physician approved effective contraception methods (oral, injectable, or implantable hormonal contraceptive; tubal ligation; intra-uterine device; barrier contraceptive with spermicide; or vasectomized partner) without interruption for 28 days or longer as required by local guidelines, prior to starting study drug, during the study therapy (including dose interruptions), and for 28 days after discontinuation of the study or longer as required by local guidelines
Females must abstain from breastfeeding starting at randomization, during study participation and for 28 days or longer as required by local guidelines, after IP discontinuation
Understand and voluntarily sign an informed consent document prior to any study related assessments/procedures are conducted
Able to adhere to the study visit schedule and other protocol requirements

Exclusion Criteria:

A subject will not be eligible for inclusion in this study if any of the following criteria apply:

Male subjects
Concurrent chemotherapy or any other anti tumor therapy for breast cancer. Prior immunotherapy & monoclonal antibody therapy are acceptable.
Subjects who received prior cytotoxic chemotherapy after incomplete resection of locoregional recurrent disease
History of, or known current evidence of brain metastasis, including leptomeningeal involvement.
Subjects with bone as the only site of metastatic disease
Subjects with regional lymph node as the only site of metastatic disease
Serious intercurrent medical or psychiatric illness, including serious active infection
History of class II-IV congestive heart failure or myocardial infarction within 6 months of randomization
History of other primary malignancy in the last 5 years prior to randomization. Subjects with prior breast cancer history are eligible, however, the most recently obtained biopsy must demonstrate triple negative disease (source documented). Subjects with prior history of in situ cancer or basal or localized squamous cell skin cancer are eligible.
Subjects with a history of interstitial lung disease, history of slowly progressive dyspnea and unproductive cough, sarcoidosis, silicosis, idiopathic pulmonary fibrosis, pulmonary hypersensitivity pneumonitis or multiple uncontrolled or unstable allergies which, in the opinion of the investigator, may lead to serious complications
Peripheral neuropathy Grade ≥ 2 by National Cancer Institute Common Terminology Criteria for Adverse Events (NCI CTCAE) v4.0
Subjects who have received an investigational product within the previous 4 weeks prior to randomization
Subject is currently enrolled, or will enroll in a different clinical study in which investigational therapeutic procedures are performed or investigational therapies are administered while participating in this study
Pregnant or nursing women
Subjects with prior hypersensitivity to nab-paclitaxel, gemcitabine, carboplatin or any other platin, or nucleoside analogue agents
Any significant medical condition, laboratory abnormality, or psychiatric illness that would prevent the subject from participating in the study
Any condition including the presence of laboratory abnormalities, which places the subject at unacceptable risk if she were to participate in the study
Any condition that confounds the ability to interpret data from the study
History of seropositive human immunodeficiency virus (HIV)
Subjects who are receiving immunosuppressive or myelosuppressive medications that would, in the opinion of the investigator, increase the risk of serious neutropenic complications",NA,NA,TRUE,FALSE,TRUE,"a subject will be eligible for inclusion in this study only if all of the following criteria are met:

female subjects, age ≥ 18 years at the time informed consent is signed
pathologically confirmed adenocarcinoma of the breast

pathologically confirmed as triple negative, source documented, defined as both of the following

estrogen receptor (er) and progesterone receptor (pgr) negative: < 1% of tumor cell nuclei are immunoreactive in the presence of evidence that the sample can express er or pgr (positive intrinsic controls)
human epidermal growth factor receptor 2 (her2) negative as per american society of clinical oncology - college of american pathologists (asco/cap) guidelines i. immunohistochemistry (ihc) 0 or 1 fluorescence in situ hybridization (fish) negative (or equivalent negative test). subjects with ihc 2 must have a negative by fluorescence in situ hybridization (fish),, (or equivalent negative test).
subjects with prior breast cancer history of different phenotypes (ie, er/pgr/her2 positive) must have pathologic confirmation of triple negative disease in at least one of the current sites of metastasis

subjects must have received prior adjuvant or neoadjuvant anthracycline therapy; unless (a) anthracycline treatment was not indicated or was not the best treatment option for the subject in the opinion of the treating physician; and (b) anthracycline treatment remains not indicated or, in the opinion of the treating physician, is not the best treatment option for the subject's metastatic disease.

a. newly diagnosed subjects presenting with tnmbc are eligible for the study if anthracycline treatment is not indicated or is not the best treatment option for the subject in the opinion of the treating physician.

subjects with measurable metastatic disease, defined by response evaluation criteria in solid tumors 1.1 (recist 1.1) guidelines
life expectancy ≥ 16 weeks from randomization
no prior cytotoxic chemotherapy for metastatic breast cancer. prior immunotherapy and/or monoclonal antibody therapy are acceptable. prior treatments must have been discontinued at least 30 days prior to start of study treatment and all related toxicities must have resolved to grade 1 or less.

prior neoadjuvant or adjuvant chemotherapy, if given, must have been completed at least 6 months before randomization with all related toxicities resolved, and documented evidence of disease progression per recist 1.1 guidelines is required.

a. if prior neoadjuvant or adjuvant chemotherapy contained taxane, gemcitabine, or platinum agents, the treatment must have completed at least 12 months before randomization

prior radiotherapy must have completed before randomization, with full recovery from acute radiation side effects. at least one measurable lesion must be completely outside the radiation portal or there must be unequivocal radiologic or clinical exam proof of progressive disease within the radiation portal, in accordance with recist 1.1 guidelines
at least 30 days from major surgery before randomization, with full recovery
eastern cooperative oncology group (ecog) performance status 0-1

subject has the following blood counts at screening:

absolute neutrophil count (anc) ≥ 1500/mm^2 ;
platelets ≥ 100,000/mm^2 ;
hemoglobin (hgb) ≥ 9 g/dl

subject has the following blood chemistry levels at screening:

aspartate aminotransferase (ast) serum glutamic-oxaloacetic transaminase (sgot), alanine aminotransferase (alt ) serum glutamic pyruvate transaminase (sgpt) ≤ 2.5 x upper limit of normal range (uln); if hepatic metastases present ≤ 5.0 x uln
total serum bilirubin ≤ uln; or total bilirubin ≤ 3.0 × uln with direct bilirubin within normal range in subjects with documented gilbert's syndrome
creatinine clearance > 60 ml/min (by cockcroft-gault)

females of child-bearing potential [defined as a sexually mature women who (1) have not undergone hysterectomy (the surgical removal of the uterus) or bilateral oophorectomy (the surgical removal of both ovaries) or (2) have not been naturally postmenopausal for at least 24 consecutive months (i.e., has had menses at any time during the preceding 24 consecutive months)] must:

demonstrate a negative serum pregnancy test result at screening (performed by central lab) confirmed by local negative urine pregnancy dipstick within 72 hours prior to the first dose of ip); pregnancy test with sensitivity of at least 25 miu/ml; and
either commit to true abstinence* from heterosexual contact (which must be reviewed on a monthly basis) or agree to use, and be able to comply with, two physician approved effective contraception methods (oral, injectable, or implantable hormonal contraceptive; tubal ligation; intra-uterine device; barrier contraceptive with spermicide; or vasectomized partner) without interruption for 28 days or longer as required by local guidelines, prior to starting study drug, during the study therapy (including dose interruptions), and for 28 days after discontinuation of the study or longer as required by local guidelines
females must abstain from breastfeeding starting at randomization, during study participation and for 28 days or longer as required by local guidelines, after ip discontinuation
understand and voluntarily sign an informed consent document prior to any study related assessments/procedures are conducted
able to adhere to the study visit schedule and other protocol requirements","

a subject will not be eligible for inclusion in this study if any of the following criteria apply:

male subjects
concurrent chemotherapy or any other anti tumor therapy for breast cancer. prior immunotherapy & monoclonal antibody therapy are acceptable.
subjects who received prior cytotoxic chemotherapy after incomplete resection of locoregional recurrent disease
history of, or known current evidence of brain metastasis, including leptomeningeal involvement.
subjects with bone as the only site of metastatic disease
subjects with regional lymph node as the only site of metastatic disease
serious intercurrent medical or psychiatric illness, including serious active infection
history of class ii-iv congestive heart failure or myocardial infarction within 6 months of randomization
history of other primary malignancy in the last 5 years prior to randomization. subjects with prior breast cancer history are eligible, however, the most recently obtained biopsy must demonstrate triple negative disease (source documented). subjects with prior history of in situ cancer or basal or localized squamous cell skin cancer are eligible.
subjects with a history of interstitial lung disease, history of slowly progressive dyspnea and unproductive cough, sarcoidosis, silicosis, idiopathic pulmonary fibrosis, pulmonary hypersensitivity pneumonitis or multiple uncontrolled or unstable allergies which, in the opinion of the investigator, may lead to serious complications
peripheral neuropathy grade ≥ 2 by national cancer institute common terminology criteria for adverse events (nci ctcae) v4.0
subjects who have received an investigational product within the previous 4 weeks prior to randomization
subject is currently enrolled, or will enroll in a different clinical study in which investigational therapeutic procedures are performed or investigational therapies are administered while participating in this study
pregnant or nursing women
subjects with prior hypersensitivity to nab-paclitaxel, gemcitabine, carboplatin or any other platin, or nucleoside analogue agents
any significant medical condition, laboratory abnormality, or psychiatric illness that would prevent the subject from participating in the study
any condition including the presence of laboratory abnormalities, which places the subject at unacceptable risk if she were to participate in the study
any condition that confounds the ability to interpret data from the study
history of seropositive human immunodeficiency virus (hiv)
subjects who are receiving immunosuppressive or myelosuppressive medications that would, in the opinion of the investigator, increase the risk of serious neutropenic complications"
